{
  "v": 2,
  "conventions": "Annex A of STORAGE.md, which is normative: an implementation MUST derive these rows for each kind it writes",
  "fixtures_are_crlf": true,
  "cases": [
    {
      "label": "mail, every field present",
      "kind": "message/rfc822",
      "fixture": "fixtures/mail-basic.eml",
      "note": "the Date carries a +02:00 offset, so the key and the date column are the UTC instant with the Z designator, never the local reading. attachment is 0 because the writer walked the one text part, and 0 without the body too (meta_attachment), the top-level Content-Type being text/plain (Annex A.1)",
      "body": { "len": 299, "blake3": "vmrssbttugq3lthad7jpxm73flnmmuqq3vvdsxj2ghqy6bfwdbra", "sha256-128": "dh4uthikps6rrobtyfukbuo6sy" },
      "link_id": "basic-1@example.org",
      "table": "mail_summary",
      "summary": { "message_id": "basic-1@example.org", "in_reply_to": ["parent-1@example.org"], "subject": "Stand-up notes", "sender": "alice@example.org", "sender_name": "Alice Example", "date": "2026-08-01T10:00:00Z", "size": 299, "attachment": 0, "invitation": null },
      "addresses": [
        { "role": "from", "position": 0, "address": "alice@example.org", "name": "Alice Example" },
        { "role": "to", "position": 0, "address": "bob@example.org", "name": null },
        { "role": "to", "position": 1, "address": "carol@example.org", "name": null }
      ],
      "sort_key": "2026-08-01T10:00:00Z",
      "meta_attachment": 0,
      "attachments": []
    },
    {
      "label": "mail, Message-ID already claimed in the collection",
      "kind": "message/rfc822",
      "fixture": "fixtures/mail-basic.eml",
      "note": "the same body the case above holds, met a second time in one mailbox under another IMAP UID: the hint is taken, so the key is minted (STORAGE §9). Same fixture on purpose, minting depending on the hint and the handle and never on the body; the two items share one object, refcounted twice, and carry identical rows",
      "body": { "len": 299, "blake3": "vmrssbttugq3lthad7jpxm73flnmmuqq3vvdsxj2ghqy6bfwdbra", "sha256-128": "dh4uthikps6rrobtyfukbuo6sy" },
      "hint": "basic-1@example.org",
      "handle": "1174",
      "link_id": "dup:basic-1@example.org#1174",
      "table": "mail_summary",
      "summary": { "message_id": "basic-1@example.org", "in_reply_to": ["parent-1@example.org"], "subject": "Stand-up notes", "sender": "alice@example.org", "sender_name": "Alice Example", "date": "2026-08-01T10:00:00Z", "size": 299, "attachment": 0, "invitation": null },
      "addresses": [
        { "role": "from", "position": 0, "address": "alice@example.org", "name": "Alice Example" },
        { "role": "to", "position": 0, "address": "bob@example.org", "name": null },
        { "role": "to", "position": 1, "address": "carol@example.org", "name": null }
      ],
      "sort_key": "2026-08-01T10:00:00Z",
      "meta_attachment": 0,
      "attachments": []
    },
    {
      "label": "mail, no Message-ID",
      "kind": "message/rfc822",
      "fixture": "fixtures/mail-no-message-id.eml",
      "note": "content stating no usable hint takes the kind's fallback in its place: alt:, the decoded subject, the date column and the sender column joined by |, each empty when absent (STORAGE §9, Annex A.1). checks/vectors.py re-derives it; a second such message in one collection mints over it like a hint (vector 31)",
      "body": { "len": 141, "blake3": "otwuvxi7drokzlnfaijscwap7n6m4glv7iqtuu6w5vqhv6uy7pia", "sha256-128": "kfaememlt26pd2lg4yhnbukwbq" },
      "link_id": "alt:Cron alert|2026-08-01T10:00:00Z|cron@example.org",
      "table": "mail_summary",
      "summary": { "message_id": null, "in_reply_to": [], "subject": "Cron alert", "sender": "cron@example.org", "sender_name": "Cron Daemon", "date": "2026-08-01T10:00:00Z", "size": 141, "attachment": 0, "invitation": null },
      "addresses": [
        { "role": "from", "position": 0, "address": "cron@example.org", "name": "Cron Daemon" },
        { "role": "to", "position": 0, "address": "ops@example.org", "name": null }
      ],
      "sort_key": "2026-08-01T10:00:00Z",
      "meta_attachment": 0,
      "attachments": []
    },
    {
      "label": "mail, encoded headers",
      "kind": "message/rfc822",
      "fixture": "fixtures/mail-encoded.eml",
      "note": "the case that split three writers: an RFC 2047 subject and display name are decoded, a quoted phrase with a comma is one name, and the addr-spec is lowercased whole (Annex A.6) while the name keeps its case. No In-Reply-To gives '[]', never NULL",
      "body": { "len": 348, "blake3": "bjkoehoowohmcp62f3lzzvicdmaavmhoey2jvlaxxhr5z4576zla", "sha256-128": "h6ijrtjfprfscqgxcqov2brhre" },
      "link_id": "encoded-1@example.org",
      "table": "mail_summary",
      "summary": { "message_id": "encoded-1@example.org", "in_reply_to": [], "subject": "Réunion de rentrée", "sender": "zoe.bruck@example.org", "sender_name": "Zöe Brück", "date": "2026-08-04T09:15:00Z", "size": 348, "attachment": 0, "invitation": null },
      "addresses": [
        { "role": "from", "position": 0, "address": "zoe.bruck@example.org", "name": "Zöe Brück" },
        { "role": "to", "position": 0, "address": "bob@example.org", "name": "Bob, Jr." },
        { "role": "cc", "position": 0, "address": "carol@example.org", "name": null },
        { "role": "cc", "position": 1, "address": "dan@example.net", "name": "Dan" }
      ],
      "sort_key": "2026-08-04T09:15:00Z",
      "meta_attachment": 0,
      "attachments": []
    },
    {
      "label": "mail, unparseable Date",
      "kind": "message/rfc822",
      "fixture": "fixtures/mail-unparseable-date.eml",
      "note": "date is NULL rather than guessed, and the empty key lands the message last in a descending listing",
      "body": { "len": 165, "blake3": "c6y4qvc2bvpf3bntujlfu6wijelnkjaeprt6afqstbdms7fi2gga", "sha256-128": "rviotkynhqei4k6i7yiofpohsm" },
      "link_id": "nodate-1@example.org",
      "table": "mail_summary",
      "summary": { "message_id": "nodate-1@example.org", "in_reply_to": [], "subject": "When?", "sender": "alice@example.org", "sender_name": "Alice Example", "date": null, "size": 165, "attachment": 0, "invitation": null },
      "addresses": [
        { "role": "from", "position": 0, "address": "alice@example.org", "name": "Alice Example" },
        { "role": "to", "position": 0, "address": "bob@example.org", "name": null }
      ],
      "sort_key": "",
      "meta_attachment": 0,
      "attachments": []
    },
    {
      "label": "mail, no Subject header",
      "kind": "message/rfc822",
      "fixture": "fixtures/mail-no-subject.eml",
      "note": "subject is NOT NULL and may be empty, so it is empty rather than NULL; the obsolete GMT zone reads as +0000",
      "body": { "len": 146, "blake3": "sof74dppzba7w5pyaob6zzc3bk7witzwpduhrn6qo4xknqquzfpq", "sha256-128": "7iivjcylgtutffe2bskjktv2du" },
      "link_id": "bare-1@example.org",
      "table": "mail_summary",
      "summary": { "message_id": "bare-1@example.org", "in_reply_to": [], "subject": "", "sender": "alice@example.org", "sender_name": null, "date": "2026-08-01T10:00:00Z", "size": 146, "attachment": 0, "invitation": null },
      "addresses": [
        { "role": "from", "position": 0, "address": "alice@example.org", "name": null },
        { "role": "to", "position": 0, "address": "bob@example.org", "name": null }
      ],
      "sort_key": "2026-08-01T10:00:00Z",
      "meta_attachment": 0,
      "attachments": []
    },
    {
      "label": "mail, two In-Reply-To ids",
      "kind": "message/rfc822",
      "fixture": "fixtures/mail-multi-reply.eml",
      "note": "In-Reply-To is 1*msg-id (RFC 5322), hence an array; each id loses its angle brackets, like message_id",
      "body": { "len": 240, "blake3": "6p5wwi7wm3bwgd6wvkfexm66mqyxxxvylw44wubrjtceiys3vmnq", "sha256-128": "u52kp67wyed4p7xiv4ayp46vpm" },
      "link_id": "multi-1@example.org",
      "table": "mail_summary",
      "summary": { "message_id": "multi-1@example.org", "in_reply_to": ["one@example.org", "two@example.org"], "subject": "Re: two parents", "sender": "alice@example.org", "sender_name": "Alice Example", "date": "2026-08-01T10:00:00Z", "size": 240, "attachment": 0, "invitation": null },
      "addresses": [
        { "role": "from", "position": 0, "address": "alice@example.org", "name": "Alice Example" },
        { "role": "to", "position": 0, "address": "bob@example.org", "name": null }
      ],
      "sort_key": "2026-08-01T10:00:00Z",
      "meta_attachment": 0,
      "attachments": []
    },
    {
      "label": "mail, a recent Date",
      "kind": "message/rfc822",
      "fixture": "fixtures/mail-recent.eml",
      "note": "the in-scope message of the scoped sync cases (SYNC.md §11); a text/plain message marks 0 with the body and without",
      "body": { "len": 241, "blake3": "zeh6d25msxa54lmheiax4ns3ajqsybejzd4afgfb7sbts4mgumma", "sha256-128": "ens3ivvm4yocui77pd7c4mkkli" },
      "link_id": "recent-1@example.org",
      "table": "mail_summary",
      "summary": { "message_id": "recent-1@example.org", "in_reply_to": [], "subject": "Today's agenda", "sender": "alice@example.org", "sender_name": "Alice Example", "date": "2026-10-06T08:30:00Z", "size": 241, "attachment": 0, "invitation": null },
      "addresses": [
        { "role": "from", "position": 0, "address": "alice@example.org", "name": "Alice Example" },
        { "role": "to", "position": 0, "address": "bob@example.org", "name": null }
      ],
      "sort_key": "2026-10-06T08:30:00Z",
      "meta_attachment": 0,
      "attachments": []
    },
    {
      "label": "mail, a Date in the future",
      "kind": "message/rfc822",
      "fixture": "fixtures/mail-future-date.eml",
      "note": "a clock set ahead: the Date is taken as stated, and a scope with an open ceiling holds it (SYNC.md §5). No Content-Type is text/plain (RFC 2045 §5.2), so no mark",